<?xml version="1.0" encoding="UTF-8" standalone="yes"?>
<lexicon schemaVersion="1.0" producer="ELAN Lexicon Editor" xmlns:xsi="http://www.w3.org/2001/XMLSchema-instance" xsi:schemaLocation="http://www.mpi.nl/tools/elan/LexiconComponent-1.0.xsd">
	<header>
		<name>test</name>
		<language>en</language>
		<description/>
		<version>1.0</version>
		<custom-fields/>
	</header>
	<entry id="e_63b26fa2-9850-4ba2-be0a-336f4d6537d6" dateCreated="2025-09-12T21:48:42.925Z" dateModified="2025-09-14T20:48:08.168Z">
		<lexical-unit>apples</lexical-unit>
		<morph-type>stem</morph-type>
		<sense id="s_2cc3bb05-1c13-407e-9770-f6c5cd77ca5b" order="1">
			<grammatical-category>n</grammatical-category>
			<gloss>apple</gloss>
		</sense>
	</entry>
	<entry id="e_a3dc82ed-05e5-4e16-bb1a-87bb03fd906f" dateCreated="2025-09-14T20:48:10.467Z" dateModified="2025-09-14T21:16:06.739Z">
		<lexical-unit>pears</lexical-unit>
		<morph-type>stem</morph-type>
		<sense id="s_d923a0cc-0883-48b5-b76d-681210706956" order="1">
			<grammatical-category>n</grammatical-category>
			<gloss>pear</gloss>
		</sense>
	</entry>
	<entry id="e_7074a2ad-d5c2-4c53-aae3-d940d4504e71" dateCreated="2025-09-15T16:29:19.622Z" dateModified="2025-09-15T16:30:14.499Z">
		<lexical-unit>peachy</lexical-unit>
		<morph-type>stem</morph-type>
		<sense id="s_8acd574b-13f8-4c92-9084-cae28ce67bd3" order="1">
			<grammatical-category>n</grammatical-category>
			<gloss>peach</gloss>
		</sense>
	</entry>
</lexicon>