<?xml version="1.0" encoding="UTF-8" standalone="yes"?>
<lexicon producer="ELAN Lexicon Editor" schemaVersion="1.0" xmlns:xsi="http://www.w3.org/2001/XMLSchema-instance" xsi:schemaLocation="http://www.mpi.nl/tools/elan/LexiconComponent-1.0.xsd"><entry dateCreated="2025-12-10T15:54:27.988Z" dateModified="2025-12-10T16:38:30.941Z" id="e_aea08ce8-2393-44d1-90a7-e4bf7debc567"><lexical-unit>something?!#%((</lexical-unit><morph-type>stem-what</morph-type><sense id="s_49bb854d-91e8-4028-a69d-b503c9ee3b4f" order="1"><gloss>whatever</gloss><grammatical-category>v</grammatical-category></sense><sense id="s_3321668d-6fe6-4715-9e8c-50c2db94e245" order="2"><gloss>Something</gloss><grammatical-category>n</grammatical-category></sense></entry><header><custom-fields/><date-created>2025-12-10T15:53:55.726Z</date-created><language>en</language><lexicon-name>New Lexicon</lexicon-name><name>something</name></header></lexicon>